{
  "schema_version": "v1",
  "receipt_id": "a170643f-1548-423f-b9e4-56e35602c892",
  "built_at": "2026-06-04T21:56:08Z",
  "image": {
    "name": "smolbsd-amd64",
    "version": "v0.1.4",
    "format": "raw",
    "output_path": "./out/smolbsd-amd64-v0.1.4.raw"
  },
  "build": {
    "host": "fbryz3070",
    "builder_type": "genoa-local",
    "os_version": "15.0-RELEASE",
    "arch": "amd64",
    "genoa_version": "v0.1.0",
    "profile": "uefi",
    "dry_run": false
  },
  "agent": {
    "name": "ii-agent",
    "version": "v0.2.0",
    "install_path": "/usr/local/bin/agent"
  },
  "hashes": {
    "image_sha256": "3edf22642e1f9df8a9f68416ef7a8b3cf05559637343e12f1b7a0955f6a4fef8",
    "manifest_sha256": "2908401449d084afbf0688b24253ca46780d3f3f4faddf06eccec4e553e1e951",
    "manifest_path": "examples/freebsd-amd64-v0.1.4.toml"
  },
  "signing": {
    "action": "unsigned",
    "tool": "none"
  },
  "claims": [
    {
      "claim": "image sha256 is 3edf22642e1f9df8a9f68416ef7a8b3cf05559637343e12f1b7a0955f6a4fef8",
      "executor": "sh",
      "probe": "openssl dgst -sha256 -r ./out/smolbsd-amd64-v0.1.4.raw | awk '{print $1}'",
      "expect": "3edf22642e1f9df8a9f68416ef7a8b3cf05559637343e12f1b7a0955f6a4fef8",
      "status": "verified"
    },
    {
      "claim": "manifest sha256 is 2908401449d084afbf0688b24253ca46780d3f3f4faddf06eccec4e553e1e951",
      "executor": "sh",
      "probe": "openssl dgst -sha256 -r examples/freebsd-amd64-v0.1.4.toml | awk '{print $1}'",
      "expect": "2908401449d084afbf0688b24253ca46780d3f3f4faddf06eccec4e553e1e951",
      "status": "verified"
    },
    {
      "claim": "agent name is ii-agent",
      "executor": "nu",
      "probe": "nu genoa.nu describe examples/freebsd-amd64-v0.1.4.toml | from json | get agent | get name",
      "expect": "ii-agent",
      "status": "asserted"
    },
    {
      "claim": "image format is raw",
      "executor": "sh",
      "probe": "file ./out/smolbsd-amd64-v0.1.4.raw",
      "expect": "raw",
      "status": "verified"
    },
    {
      "claim": "target os is freebsd",
      "executor": "nu",
      "probe": "nu genoa.nu describe examples/freebsd-amd64-v0.1.4.toml | from json | get target | get os",
      "expect": "freebsd",
      "status": "asserted"
    }
  ]
}